{
  "blocking_reasons": [
    "Layout unsatisfiable due to local_repair_exhausted.",
    "Layout unsatisfiable due to local_repair_exhausted.",
    "Layout unsatisfiable due to local_repair_exhausted.",
    "Layout unsatisfiable due to local_repair_exhausted."
  ],
  "currency": "INR",
  "lines": [],
  "quote_id": "QUOTE-ROOM-03",
  "room_id": "ROOM-03",
  "status": "blocked",
  "summary": {
    "grand_total_inr": 0
  }
}
